Track Name,Artist,Genres
Swing Lynn,Harmless,modern dream pop
The Less I Know The Better,Tame Impala,"australian psych, modern rock, neo-psychedelic, rock"
Young,Vacations,"newcastle nsw indie, pov: indie"
Black Out Days - Future Islands Remix,Phantogram,"indietronica, metropopolis, neo-synthpop"
High You Are,What So Not,"aussietronica, brostep, edm, electro house, electronic trap, escape room, vapor twitch"
"Don't Think Twice, It's All Right",Bob Dylan,"classic rock, country rock, folk, folk rock, rock, roots rock, singer-songwriter"
Pluto Projector,Rex Orange County,bedroom pop
Innerbloom,RÜFÜS DU SOL,"australian electropop, indietronica"
Los Angeles,The Midnight,"nightrun, popwave"
Space Song,Beach House,"art pop, baltimore indie, dream pop, dreamo, indie rock, indietronica, modern dream pop, pov: indie"
Let It Happen,Tame Impala,"australian psych, modern rock, neo-psychedelic, rock"
Call It What You Want,Foster The People,"indietronica, modern alternative rock, modern rock, rock"
First Day Of My Life,Bright Eyes,"chamber pop, indie rock, melancholia, omaha indie, stomp and holler"
How I Get Myself Killed,Indigo De Souza,"asheville indie, bubblegrunge, indie pop"
I Think I Like When It Rains,WILLIS,alabama indie
K.,Cigarettes After Sex,"ambient pop, dream pop, el paso indie, shoegaze"
ON TOP,The Girl Next Door,weirdcore
California Dreamin' - Single Version,The Mamas & The Papas,"classic rock, folk rock, mellow gold, psychedelic rock, rock, soft rock, sunshine pop"
Hurt,Johnny Cash,"arkansas country, outlaw country, rock"
Time to Pretend,MGMT,"alternative rock, indie rock, indietronica, modern rock, rock"
Funky Thang,Shay Lia,"alternative r&b, canadian contemporary r&b, canadian pop, montreal indie"
Where Is My Mind? - 2007 Remaster,Pixies,"alternative rock, boston rock, permanent wave, rock"
Apocalypse,Cigarettes After Sex,"ambient pop, dream pop, el paso indie, shoegaze"
Take a Walk,Passion Pit,"indie rock, indietronica, modern rock, neo-synthpop, shimmer pop"
Doses & Mimosas,Cherub,Unknown
Heat Waves,Glass Animals,"gauze pop, indietronica, modern rock, pov: indie, shiver pop"
Borderline,Tame Impala,"australian psych, modern rock, neo-psychedelic, rock"
Althea - 2013 Remaster,Grateful Dead,"cosmic american, jam band, psychedelic rock"
Gap in the Clouds,Yellow Days,bedroom pop
In My Room,Frank Ocean,"lgbtq+ hip hop, neo soul"
The Light,Metronomy,"alternative dance, electronica, french indie pop, indietronica, neo-synthpop, new rave, socal pop punk"
The Difference,Flume,"australian dance, australian electropop, australian indie, downtempo, edm, indietronica"
Amour plastique,Videoclub,"french indie pop, french synthpop"
You,Petit Biscuit,new french touch
Gloria,The Lumineers,"folk-pop, modern rock, neo mellow, stomp and holler"
Me Voy Pa'l Pueblo,Mapache,neo-psychedelic
Youth,Glass Animals,"gauze pop, indietronica, modern rock, pov: indie, shiver pop"
Arcade,Duncan Laurence,dutch pop
Firestone,Kygo,"edm, pop, pop dance, tropical house"
Lemon Glow,Beach House,"art pop, baltimore indie, dream pop, dreamo, indie rock, indietronica, modern dream pop, pov: indie"
Intro,The xx,"downtempo, dream pop, indietronica"
"Hold On, We're Going Home",Drake,"canadian hip hop, canadian pop, hip hop, pop rap, rap"
Silver Soul,Beach House,"art pop, baltimore indie, dream pop, dreamo, indie rock, indietronica, modern dream pop, pov: indie"
Always Forever,Cults,"experimental pop, indie surf, pov: indie"
Sign of the Times,Harry Styles,pop
Forever Young,Alphaville,"new romantic, new wave pop, synthpop"
Kiss With A Fist,Florence + The Machine,"baroque pop, modern rock, neo mellow, uk alternative pop"
To Build A Home,The Cinematic Orchestra,"downtempo, nu jazz"
Jungle,Tash Sultana,australian reggae fusion
Tongue Tied,GROUPLOVE,"indie rock, la indie, modern alternative rock, modern rock, pov: indie"
I Need Some Sleep,Eels,"alternative rock, chamber pop, melancholia"
It Was A Good Day,Ice Cube,"conscious hip hop, g funk, gangster rap, hip hop, rap, west coast rap"
Funny Thing,Thundercat,"afrofuturism, indie soul"
Rocky,Still Woozy,"bedroom pop, oakland indie, pov: indie"
The King,Sarah Kinsley,"gen z singer-songwriter, indie pop"
212,Azealia Banks,"escape room, hip house, lgbtq+ hip hop, trap queen"
midnight sun (ramzoid x hal walker),ZOID LAND,sad lo-fi
Saturn,Sleeping At Last,"ambient worship, chamber pop"
Cigarette Daydreams,Cage The Elephant,"modern alternative rock, modern rock, pov: indie, punk blues, rock"
Je te laisserai des mots,Patrick Watson,"indie folk, indie quebecois"
September,"Earth, Wind & Fire","disco, funk, jazz funk, motown, soul"
Heaven,Los Lonely Boys,Unknown
City Of Stars,Ryan Gosling,hollywood
Epilogue,Justin Hurwitz,"hollywood, movie tunes"
Maps,STRFKR,"indie rock, indietronica"
The Spins,Mac Miller,"hip hop, pittsburgh rap, rap"
Dancing in the Moonlight (feat. NEIMY),Jubël,swedish pop
The Thrill,Wiz Khalifa,"hip hop, pittsburgh rap, pop rap, rap, southern hip hop, trap"
Sleep Walk,Santo & Johnny,"space age pop, surf music"
Blood On The Leaves,Kanye West,"chicago rap, hip hop, rap"
Leave The Door Open,Bruno Mars,"dance pop, pop"
Gooey,Glass Animals,"gauze pop, indietronica, modern rock, pov: indie, shiver pop"
Sedona,Houndmouth,"indie folk, modern folk rock, new americana, stomp and holler"
Feel So Close - Radio Edit,Calvin Harris,"dance pop, edm, electro house, house, pop, progressive house, uk dance"
Lights Are On,Tom Rosenthal,british singer-songwriter
STAY (with Justin Bieber),The Kid LAROI,australian hip hop
Crew (feat. Brent Faiyaz & Shy Glizzy),GoldLink,alternative r&b
Wait a Minute!,WILLOW,"afrofuturism, pop, post-teen pop, pov: indie"
Jerk It Out,Caesars,swedish indie rock
Window,Still Woozy,"bedroom pop, oakland indie, pov: indie"
My Kind of Woman,Mac DeMarco,"edmonton indie, lo-fi indie, pov: indie, slacker rock"
Machu Picchu,The Strokes,"alternative rock, garage rock, modern rock, permanent wave, rock"
La vie en rose - Single Version,Louis Armstrong,"adult standards, dixieland, harlem renaissance, jazz trumpet, lounge, new orleans jazz, soul, swing, vocal jazz"
Changing of the Seasons,Two Door Cinema Club,"indie rock, indietronica, irish rock, modern alternative rock, modern rock, northern irish indie"
What You Know,Two Door Cinema Club,"indie rock, indietronica, irish rock, modern alternative rock, modern rock, northern irish indie"
Eternal Summer,The Strokes,"alternative rock, garage rock, modern rock, permanent wave, rock"
"City Of Stars - From ""La La Land"" Soundtrack",Ryan Gosling,hollywood
Can I Call You Tonight?,Dayglow,"austindie, indie rock, pov: indie"
Hot Rod,Dayglow,"austindie, indie rock, pov: indie"
Only Human,Jonas Brothers,"boy band, pop"
"Gettin' By, High and Strange",Kris Kristofferson,"country, country rock, outlaw country, singer-songwriter"
Luckiest Man,The Wood Brothers,"jam band, modern blues, new americana, progressive bluegrass, roots rock, stomp and holler"
Can't You See,The Marshall Tucker Band,"album rock, classic rock, country rock, mellow gold, singer-songwriter, soft rock, southern rock"
Slow Cheetah,Red Hot Chili Peppers,"alternative rock, funk metal, funk rock, permanent wave, rock"
Laundry Room,The Avett Brothers,"indie folk, new americana, north carolina indie, north carolina roots, progressive bluegrass, stomp and holler"
Cherry Flavoured,The Neighbourhood,"modern alternative rock, modern rock, pop"
Green Onions,Booker T. & the M.G.'s,"blues, classic soul, instrumental funk, instrumental soul, memphis soul, soul, southern soul, traditional blues"
Honeypie,JAWNY,"bedroom pop, pov: indie"
Let's Groove,"Earth, Wind & Fire","disco, funk, jazz funk, motown, soul"
Don't Stop 'Til You Get Enough,Michael Jackson,"r&b, soul"
Ho Hey,The Lumineers,"folk-pop, modern rock, neo mellow, stomp and holler"
Island In The Sun,Weezer,"alternative rock, modern power pop, modern rock, permanent wave, rock"
MIDDLE CHILD,J. Cole,"conscious hip hop, hip hop, north carolina hip hop, rap"
Undercover Martyn,Two Door Cinema Club,"indie rock, indietronica, irish rock, modern alternative rock, modern rock, northern irish indie"
Violent Crimes,Kanye West,"chicago rap, hip hop, rap"
She Knows (feat. Amber Coffman & Cults),J. Cole,"conscious hip hop, hip hop, north carolina hip hop, rap"
forever&more,ROLE MODEL,"alt z, bedroom pop, pov: indie"
Pink + White,Frank Ocean,"lgbtq+ hip hop, neo soul"
Praise God,Kanye West,"chicago rap, hip hop, rap"
Moon,Kanye West,"chicago rap, hip hop, rap"
hello!,ROLE MODEL,"alt z, bedroom pop, pov: indie"
say it first,ROLE MODEL,"alt z, bedroom pop, pov: indie"
Mando Calrissian,CZARFACE,alternative hip hop
Tangerine,Glass Animals,"gauze pop, indietronica, modern rock, pov: indie, shiver pop"
Domestic Bliss,Glass Animals,"gauze pop, indietronica, modern rock, pov: indie, shiver pop"
Helium,Glass Animals,"gauze pop, indietronica, modern rock, pov: indie, shiver pop"
I Don't Wanna Talk (I Just Wanna Dance),Glass Animals,"gauze pop, indietronica, modern rock, pov: indie, shiver pop"
play the part,ROLE MODEL,"alt z, bedroom pop, pov: indie"
Yesterday - Remastered 2009,The Beatles,"british invasion, classic rock, merseybeat, psychedelic rock, rock"
I Want To Hold Your Hand - Remastered 2015,The Beatles,"british invasion, classic rock, merseybeat, psychedelic rock, rock"
Like I Can,Sam Smith,"pop, uk pop"
Dissolve Me,alt-J,"indie rock, indietronica, modern alternative rock, modern rock, rock"
Safe And Sound,Capital Cities,"metropopolis, modern rock"
Slide (feat. Frank Ocean & Migos),Calvin Harris,"dance pop, edm, electro house, house, pop, progressive house, uk dance"
Thank You,Dido,"dance pop, europop, lilith, neo mellow, pop rock"
Ophelia,The Lumineers,"folk-pop, modern rock, neo mellow, stomp and holler"
Flowers in Your Hair,The Lumineers,"folk-pop, modern rock, neo mellow, stomp and holler"
Left Hand Free,alt-J,"indie rock, indietronica, modern alternative rock, modern rock, rock"
Age Ye Rooz,Faramarz Aslani,classic persian pop
High Enough,K.Flay,"escape room, hip pop, modern alternative rock"
Girl from the North Country,Bob Dylan,"classic rock, country rock, folk, folk rock, rock, roots rock, singer-songwriter"
November 18th,Drake,"canadian hip hop, canadian pop, hip hop, pop rap, rap"
The 90s,FINNEAS,"alt z, la indie, pop, pov: indie"
West Coast Love,Emotional Oranges,indie r&b
notice me - acoustic,ROLE MODEL,"alt z, bedroom pop, pov: indie"
You Are the Right One,Sports,tulsa indie
Oh! Sweet Nuthin' - 2015 Remaster,The Velvet Underground,"alternative rock, melancholia, permanent wave, protopunk, rock"
Drugs,M.A.G.S.,buffalo ny indie
One Day,Matisyahu,reggae fusion
Taro,alt-J,"indie rock, indietronica, modern alternative rock, modern rock, rock"
The Adults Are Talking,The Strokes,"alternative rock, garage rock, modern rock, permanent wave, rock"
Tessellate,alt-J,"indie rock, indietronica, modern alternative rock, modern rock, rock"
Then Came the Last Days of May,Blue Öyster Cult,"album rock, classic rock, glam metal, hard rock, progressive rock, rock"
Tangerine - Remaster,Led Zeppelin,"album rock, classic rock, hard rock, rock"
Time,Pink Floyd,"album rock, art rock, classic rock, progressive rock, psychedelic rock, rock, symphonic rock"
Lonesome Town,Ricky Nelson,"adult standards, doo-wop, rock-and-roll, rockabilly"
Looking Out for You,Joy Again,pov: indie
Choking on Flowers,Fox Academy,"indie garage rock, lo-fi indie"
Stubborn Love,The Lumineers,"folk-pop, modern rock, neo mellow, stomp and holler"
High Tops,Del Water Gap,"deep new americana, indie pop, pov: indie"
Nothing,Bruno Major,singer-songwriter pop
Notion,The Rare Occasions,la indie
Awaken,Big Wild,vapor soul
Someone Like You,Adele,"british soul, pop, pop soul, uk pop"
La vie en rose - Single Version,Louis Armstrong,"adult standards, dixieland, harlem renaissance, jazz trumpet, lounge, new orleans jazz, soul, swing, vocal jazz"
Fragile,Kygo,"edm, pop, pop dance, tropical house"
Sol Del Sur,Sun Room,Unknown
Instant Crush (feat. Julian Casablancas),Daft Punk,"electro, filter house, rock"
The Way I Are,Timbaland,"dance pop, pop, pop rap"
Happier Than Ever,Billie Eilish,"art pop, pop"
Gymnopédie No. 1,Erik Satie,"classical, early avant garde, early modern classical, impressionism, post-romantic era"
The Way You'd Love Her,Mac DeMarco,"edmonton indie, lo-fi indie, pov: indie, slacker rock"
Ivy,Frank Ocean,"lgbtq+ hip hop, neo soul"
Lost,Frank Ocean,"lgbtq+ hip hop, neo soul"
I Love You So,The Walters,"chicago indie, pov: indie"
Shut up My Moms Calling,Hotel Ugly,modern indie pop
This Song Is Not About A Girl,Flume,"australian dance, australian electropop, australian indie, downtempo, edm, indietronica"
Cancun Sega - luxuriøus Remix,ScrewStache,Unknown
Where'd All the Time Go?,Dr. Dog,"chamber pop, indie rock, modern folk rock, philly indie, pov: indie, seattle indie, stomp and holler"
Rock with You - Single Version,Michael Jackson,"r&b, soul"
Stolen Dance,Milky Chance,"german pop, modern rock"
Flashed Junk Mind,Milky Chance,"german pop, modern rock"
Mind Over Matter (Reprise),Young the Giant,"indietronica, modern alternative rock, modern rock, pov: indie, stomp and holler"
The Way You'd Love Her,Mac DeMarco,"edmonton indie, lo-fi indie, pov: indie, slacker rock"
Photograph,Ed Sheeran,"pop, singer-songwriter pop, uk pop"
You Know How We Do It,Ice Cube,"conscious hip hop, g funk, gangster rap, hip hop, rap, west coast rap"
Mind Over Matter,Young the Giant,"indietronica, modern alternative rock, modern rock, pov: indie, stomp and holler"
Total Eclipse of the Heart,Bonnie Tyler,"europop, new wave pop, soft rock"
Dancin - Deep House Remix,Eduardo Luzquiños,Unknown
Happy Endings,Faul,saxophone house
Something About You,Eyedress,"noise pop, pov: indie"
Freaking Out the Neighborhood,Mac DeMarco,"edmonton indie, lo-fi indie, pov: indie, slacker rock"
I See Fire,Ed Sheeran,"pop, singer-songwriter pop, uk pop"
Riders on the Storm,The Doors,"acid rock, album rock, classic rock, hard rock, psychedelic rock, rock"
Crazy,Gnarls Barkley,"atl hip hop, neo soul"
Smoke Two Joints,Sublime,"rap rock, reggae fusion, ska mexicano, ska punk"
Song 2 - 2012 Remaster,Blur,"alternative rock, britpop, madchester, permanent wave, rock"
Pool,Still Woozy,"bedroom pop, oakland indie, pov: indie"
INTERLUDE,Lord Nobel,Unknown
Stars Will Fall,Duster,"corecore, dream pop, pov: indie, slowcore"
Hot Blooded,New Constellations,Unknown
Ode To The Mets,The Strokes,"alternative rock, garage rock, modern rock, permanent wave, rock"
Take It Easy - 2013 Remaster,Eagles,"album rock, classic rock, heartland rock, mellow gold, rock, soft rock, yacht rock"
The Gambler,Kenny Rogers,"classic country pop, country, nashville sound, soft rock"
Kids,MGMT,"alternative rock, indie rock, indietronica, modern rock, rock"
Gypsy Woman (She's Homeless) (La Da Dee La Da Da) - Basement Boy Strip To The Bone Mix,Crystal Waters,diva house
Electric Feel,MGMT,"alternative rock, indie rock, indietronica, modern rock, rock"
WASTE,KXLLSWXTCH,"dark trap, oc rap, scream rap"
"Main Title (from ""Taxi Driver"")",Bernard Herrmann,classic soundtrack
You Are My Sunshine,Johnny Cash,"arkansas country, outlaw country, rock"
rx,ROLE MODEL,"alt z, bedroom pop, pov: indie"
Your Love,The Outfield,power pop
Where's My Love,SYML,modern indie pop
Home,Edith Whiskers,Unknown
life is funny,ROLE MODEL,"alt z, bedroom pop, pov: indie"
stripclub music,ROLE MODEL,"alt z, bedroom pop, pov: indie"
Casita,Goth Babe,"indie rock, pov: indie"
Under Cover of Darkness,The Strokes,"alternative rock, garage rock, modern rock, permanent wave, rock"
Brooklyn Bridge To Chorus,The Strokes,"alternative rock, garage rock, modern rock, permanent wave, rock"
Paris,Magic Man,"hopebeat, indie poptimism, shimmer pop"
Brazil,Declan McKenna,pov: indie
Until I Found You,Stephen Sanchez,gen z singer-songwriter
On & On,Cartoon,gaming edm
Vibrations,070 Shake,new jersey rap
MANGO (feat. Adi Oasis),KAMAUU,downtempo bass
Save Your Tears,The Weeknd,"canadian contemporary r&b, canadian pop, pop"
Massive,Drake,"canadian hip hop, canadian pop, hip hop, pop rap, rap"
Kilby Girl,The Backseat Lovers,"pov: indie, slc indie"
Dear To Me,Electric Guest,"indietronica, la indie, shimmer pop"
Solitude,M83,"french shoegaze, french synthpop, indietronica, metropopolis, neo-synthpop"
Solitude - Felsmann + Tiley Reinterpretation,M83,"french shoegaze, french synthpop, indietronica, metropopolis, neo-synthpop"
Massive,Drake,"canadian hip hop, canadian pop, hip hop, pop rap, rap"
All I Want,Kodaline,"irish pop, modern rock, neo mellow"
Ava,Famy,Unknown
The Mission,Bakar,uk alternative hip hop
Take Me Where Your Heart Is,Q,"alternative r&b, indie r&b"
Song on the Beach,Arcade Fire,"alternative rock, baroque pop, canadian indie, canadian indie rock, chamber pop, indie rock, indietronica, modern rock, permanent wave, quebec indie, rock"
Behind The Sun,ODESZA,"chillwave, edm, indietronica"
Analie,Stolen Gin,Unknown
Chateau (Feel Alright),Djo,"pov: indie, psychedelic pop"
Sweet Disposition,The Temper Trap,"indietronica, modern rock, shimmer pop"
sdp interlude,Travis Scott,"rap, slap house"
NDA,Billie Eilish,"art pop, pop"
The Prayer,Kid Cudi,"hip hop, ohio hip hop, pop rap, rap"
Chan Chan,Buena Vista Social Club,"latin jazz, musica tradicional cubana, world"
X,Nicky Jam,"latin hip hop, reggaeton, trap latino, urbano latino"
Cry,Cigarettes After Sex,"ambient pop, dream pop, el paso indie, shoegaze"
Girl (feat. KAYTRANADA),The Internet,"alternative r&b, lgbtq+ hip hop"
All The Stars (with SZA),Kendrick Lamar,"conscious hip hop, hip hop, rap, west coast rap"
The Beach,The Neighbourhood,"modern alternative rock, modern rock, pop"
Saghi,Hayedeh,"classic persian pop, musiqi-ye zanan"
PERSIAN RUGS,PARTYNEXTDOOR,"r&b, rap, urban contemporary"
Running Away,VANO 3000,Unknown
I Wonder,Kanye West,"chicago rap, hip hop, rap"
Jimmy Cooks (feat. 21 Savage),Drake,"canadian hip hop, canadian pop, hip hop, pop rap, rap"
Music Sounds Better With You,Stardust,filter house
La La La,LMFAO,"dance pop, pop, pop rap"
Righteous,Mo Beats,Unknown
Put It on Me,Frankie Stew and Harvey Gunn,uk alternative hip hop
B.O.T.A. (Baddest Of Them All) - Edit,Eliza Rose,house
Bul Beni,Sedef Sebüktekin,"turkish alt pop, turkish rock"
Colors,Black Pumas,retro soul
Hotel California - 2013 Remaster,Eagles,"album rock, classic rock, heartland rock, mellow gold, rock, soft rock, yacht rock"
Drive Slow,Kanye West,"chicago rap, hip hop, rap"
Those Eyes,New West,toronto indie
The Darkness That You Fear,The Chemical Brothers,"alternative dance, big beat, breakbeat, electronica, rave, trip hop"
Black (feat. Norah Jones),Danger Mouse,"alternative hip hop, mashup"
Young Folks,Peter Bjorn and John,"alternative dance, baroque pop, dance-punk, indie rock, modern rock, new rave, swedish alternative rock, swedish indie pop"
Chamber Of Reflection,Mac DeMarco,"edmonton indie, lo-fi indie, pov: indie, slacker rock"
Eu Sou O Mestre Dos Magos,DJ GRZS,"funk mandelao, funk mtg"
Bad Habit,Steve Lacy,afrofuturism
Champagne Coast,Blood Orange,"alternative r&b, art pop, escape room, indie soul, indietronica, metropopolis"
The Beat Goes On,Beady Eye,britpop
Agitations tropicales,L'Impératrice,"french indie pop, french indietronica, french synthpop"
Vanille fraise,L'Impératrice,"french indie pop, french indietronica, french synthpop"
LONDON (feat. J. Cole),BIA,"rap latina, trap queen"
Cherry,Lana Del Rey,"art pop, pop"
agony,*:･ﾟ✧*:･ﾟ✧ .・゜゜・,Unknown
Canary Islands,Goth Babe,"indie rock, pov: indie"
Sometimes,Goth Babe,"indie rock, pov: indie"
Miss You,southstar,pop dance
Madan (King),Bakermat,"minimal tech house, tropical house"
Ain't No Sunshine,Bill Withers,"classic soul, funk, quiet storm, soul"
Morning Coffee,Jack Davies and The Bush Chooks,fremantle indie
Drank & Drugs,Lil Kleine,"dutch hip hop, dutch rap pop"
Bulletproof,La Roux,"alternative dance, electropop, indietronica, neo-synthpop"
Power,Interupt,bassline
Sweater Weather,Jomarijan,gym hardstyle
Didn't I,Darondo,"afrobeat, classic soul, funk"
Nosebleed Seats,Vansire,"bedroom pop, rochester mn indie"
saw u in a dream,tyke james,Unknown
Aces,dkj,Unknown
Snowshoes,Caamp,"indie folk, stomp and holler"
Ruby Fields,Sarah and the Sundays,connecticut indie
1977,Ana Tijoux,"chilean rock, latin alternative, latintronica, rap chileno, rap feminino chileno, rap latina, rap politico"
Smthng,Muddy Monk,"french indie pop, french indietronica"
Surfing in Iceland,Goth Babe,"indie rock, pov: indie"
Santa Cruz Tomorrow,French Cassettes,Unknown
Turn On The Lights again.. (feat. Future),Fred again..,"edm, house, stutter house"
Heaven Takes You Home (feat. Connie Constance) - Alternative Mix,Swedish House Mafia,"edm, pop dance, progressive electro house"
DEVOTION,Mild Minds,australian dance
Tidalwave,Moksi,"bass house, brostep, dutch edm, electro house, electronic trap"
DESTINATIONS,Mild Minds,australian dance
White Christmas,The Drifters,"adult standards, classic soul, doo-wop, rock-and-roll, rockabilly, soul"
Psycho Killer - Live,Talking Heads,"alternative rock, art punk, dance rock, funk rock, new wave, permanent wave, post-punk, rock, zolo"
Brown Eyed Girl,Van Morrison,"classic rock, folk, folk rock, mellow gold, rock, singer-songwriter, soft rock"
The Perfect Girl,Mareux,dark synthpop
this feeling,Øneheart,hardwave
Too Many Nights (feat. Don Toliver & with Future),Metro Boomin,rap
Dancin - Krono Remix,Aaron Smith,chicago house
Bongo Bong,Manu Chao,"latin alternative, world"
1979,Mareux,dark synthpop
Killer Whale,Boyscott,"chill dream pop, indie garage rock"
Nevermore,Denis Stelmakh,Unknown
7 Weeks & 3 Days,yungatita,weirdcore
Chamber of Reflection (Live Cover),Your Anxiety Buddy,corecore
ザ・ワード II,セキトオ・シゲオ,classic japanese jazz
Will I See You Again?,Thee Sacred Souls,"latinx alternative, souldies"
COULD BE WRONG,LOSTBOYJAY,rally house
Surrender To Me,FireCityFunk,Unknown
We Come Running,Youngblood Hawke,"la indie, shimmer pop"
Margaritaville,Jimmy Buffett,trop rock
Jailhouse Rock,Elvis Presley,"rock-and-roll, rockabilly"
september sped up,griddyy,Unknown
the BLACK seminole.,Lil Yachty,"atl hip hop, melodic rap, rap, trap"
White Sails,Sterling Grove,Unknown
Ain't No Sunshine,Bill Withers,"classic soul, funk, quiet storm, soul"
Aquamarine (feat. Michael Kiwanuka),Danger Mouse,"alternative hip hop, mashup"
Busy Earnin',Jungle,"indie soul, uk contemporary r&b"
I Was Never There,The Weeknd,"canadian contemporary r&b, canadian pop, pop"
Guilty Conscience - Tame Impala Remix,070 Shake,new jersey rap
Lamb's Wool,Foster The People,"indietronica, modern alternative rock, modern rock, rock"
The Ballad of Eddie Jabuley,Hotel Ugly,modern indie pop
Sure Thing,Miguel,"r&b, urban contemporary"
It's Called: Freefall,Rainbow Kitten Surprise,pov: indie
Zombie,The Cranberries,"irish rock, pop rock, rock"
Walk Em Down (Don't Kill Civilians) [with 21 Savage & feat. Mustafa],Metro Boomin,rap
First Flight To Mars,Ark Woods,Unknown
Candela,Buena Vista Social Club,"latin jazz, musica tradicional cubana, world"
Hometown (intro),French 79,"french indie pop, french indietronica"
Hometown,French 79,"french indie pop, french indietronica"
Lovin' Feeling,French 79,"french indie pop, french indietronica"
Watch This - ARIZONATEARS Pluggnb Remix,Lil Uzi Vert,"hip hop, melodic rap, philly rap, rage rap, rap, trap"
Evergreen,Richy Mitch & The Coal Miners,modern folk rock
Rips in Jeans,Niko B,Unknown
Can't Sleep,VENICE,Unknown
Song For No One,Miike Snow,"alternative dance, electropop, indietronica, neo-synthpop, shimmer pop, swedish electropop, swedish indie pop, swedish synthpop"
Stop This Flame,Celeste,british soul
I Will Survive - Single Version,Gloria Gaynor,"disco, soft rock"
September - Instrumental,Sparky Deathcap,Unknown
Bag End,Howard Shore,"canadian classical, canadian soundtrack, middle earth, orchestral soundtrack, scorecore, soundtrack"
"Don't Think Twice, It's All Right","Peter, Paul and Mary","american folk revival, folk, folk rock, mellow gold, singer-songwriter, soft rock"
"Genius (feat. Sia, Diplo, and Labrinth)",Sia,pop
EARFQUAKE,"Tyler, The Creator","hip hop, rap"
Die Trying,Key Glock,"memphis hip hop, rap, southern hip hop, tennessee hip hop, trap"
Atomic Vomit,Steve Lacy,afrofuturism
Cissy Strut,The Meters,"funk, instrumental soul, jazz funk, new orleans funk, p funk, soul"
Food for the Soul,it's murph,stutter house
Dreaming - Gibson Parker Remix,Rootkit,"chillstep, complextro, electro house, gaming edm, melodic dubstep"
Soledad y el Mar (feat. Los Macorinos),Natalia Lafourcade,"cantautora mexicana, latin alternative, latin pop, mexican pop, rock en espanol, veracruz indie"
A Bird's Last Look,Macabre Plaza,"hypnagogic pop, utopian virtual"
Time (You and I),Khruangbin,"indie soul, neo-psychedelic, world"
Tell Me,Sharon Jones & The Dap-Kings,"black americana, funk, retro soul, soul"
"After The Storm (feat. Tyler, The Creator & Bootsy Collins)",Kali Uchis,colombian pop
PRIDE.,Kendrick Lamar,"conscious hip hop, hip hop, rap, west coast rap"
Ella Baila Sola,Eslabon Armado,"corrido, corridos tumbados, sad sierreno, sierreno"
Cash In Cash Out,Pharrell Williams,"dance pop, pop"
Panama,Sports,tulsa indie
Reborn,KIDS SEE GHOSTS,rap
Where You Are,John Summit,house
Belize (feat. MF DOOM),Danger Mouse,"alternative hip hop, mashup"
Cola - Club Mix,CamelPhat,"deep tech house, house, progressive house, uk dance"
Trance (with Travis Scott & Young Thug),Metro Boomin,rap
Séquences - Parcels Remix,L'Impératrice,"french indie pop, french indietronica, french synthpop"
Cola x Nanana,marcusas,Unknown
Rapp Snitch Knishes feat. Mr. Fantastik,MF DOOM,"east coast hip hop, hip hop, instrumental hip hop, rap"
I Know The End,Phoebe Bridgers,"indie pop, la indie, pov: indie"
Cradles,Sub Urban,modern indie pop
A Rose Blooms in Chaos,Davishmar,Unknown
Kuzola,Pongo,african electronic
"Yo x Ti, Tu x Mi",ROSALÍA,"pop, r&b en espanol"
The Look,Metronomy,"alternative dance, electronica, french indie pop, indietronica, neo-synthpop, new rave, socal pop punk"
